<?xml version="1.0"?>


<xs:schema version="1.0"
           xmlns:xs="http://www.w3.org/2001/XMLSchema"
           elementFormDefault="qualified">

    <xs:element name="root">
        <xs:complexType>
            <xs:sequence>
                <xs:element name="introduction">
                    <xs:complexType>
                        <xs:sequence>
                            <xs:element name="title" type="xs:string"/>
                            <xs:element name="link" type="xs:string"/>
                            <xs:element name="description" type="xs:string"/>
                        </xs:sequence>
                    </xs:complexType>
                </xs:element>
                <xs:element name="notice" maxOccurs="unbounded">
                    <xs:complexType>
                        <xs:sequence>
                            <xs:element name="title" type="xs:string"/>
                            <xs:element name="link" type="xs:string"/>
                            <xs:element name="description" type="xs:string"/>
                        </xs:sequence>
                    </xs:complexType> 
                </xs:element>
            </xs:sequence>
        </xs:complexType>
    </xs:element>

</xs:schema>
